"","property_id","city","price","month","year","surface_total","surface_covered","rooms","bedrooms","bathrooms","property_type","operation_type","title","description","balcony","garage","geometry","distancia_parque","area__parque","distancia_parque_infatil","distancia_hospital","distancia_clinica","distancia_estacion_bus","distancia_policia","distancia_colegio","distancia_mercado"
"1","2d2f627f2a73cd6ace7e6dab","Bogotá D.C",480000000,8,2021,NA,NA,4,4,3,0,"Venta","se vende apartamento en galerias","se vende lindo apartamento 3y4 piso remodelado exterior en galerias","0","0",c(-74.063051, 4.649258),638.086657471023,4180.64713604209,638.086657471023,397.90109031335,620.099738706527,228.425723733563,137.210874146358,396.419687714713,1105.59485273183
"2","27d8e55a6032d210885fdd4c","Bogotá D.C",1400000000,7,2021,227,NA,3,3,1,0,"Venta","apartamento en en rosales calle 81","excelente oportunidad para remodelar espectacular apartamento en los rosales 227 mts mas 13 mts distribuidos en dos terrazas segundo piso exterior dos parqueaderos un deposito tres habitaciones cada una con bano privado banos social bano de servicio un estudio dos salas comedor independiente zona de lavanderia independiente cocina con isla excelente oportunidad informes x","1","1",c(-74.0486934, 4.6614416),95.9184710514476,2048.3429984337,95.9184710514476,1164.43233990573,1162.94242282136,1405.40101815135,591.483513822623,412.424684325179,2937.84428159674
"3","84a9da9d84b975bcd0954c36","Bogotá D.C",749000000,7,2021,86,NA,2,2,1,0,"Venta","apartamento en refugio 87 exterior","apartamento en en chico refugio de 86 m2 en segundo piso exterior con balcon 2 habitaciones la principal con bano privado bano de alcobas y bano social sala comedor con chimenea y balcon cocina abierta tipo americano zona de lavanderia independiente parqueadero y deposito gym salon comunal zona infantil y terraza panoramica con bbq informes x","1","1",c(-74.0447616577, 4.667227244),203.290598084418,392.666068652185,203.290598084418,1290.00579016206,1325.07755833211,1714.84967832926,674.742951796588,205.096820278284,2726.40120596261
"4","b8cfaa53d82564bf7572175a","Bogotá D.C",1200000000,8,2021,10,NA,3,3,4,0,"Venta","apartamento serramonte pm","hermoso apartamento carrera 6 con calle 125 ideal para remodelar apartamento ubicado en el 10mo piso con ascensor privado directo apto hall de entrada sala cuenta con chimenea comedor y estudio bano social cocina integral con comedor auxiliar zona de lavanderia cuarto y bano de servicio puerta de salida a las escaleras de emergencia el apartamento cuenta con sistema automatico de encendido y pagado de luces 2 parqueaderos cubiertos en linea deposito el conjunto cuenta con planta de reserva de energia y tanques de almacenamiento de agua red de gas natural vigilancia y supervisor de seguridad las 24 horas camaras de seguridad y acceso al conjunto y cada torre con huella dactilar o token","0","1",c(-74.0486884117, 4.66167742),114.855749740874,2048.3429984337,114.855749740874,1148.23357660899,1146.521506463,1402.98804690155,617.675387624916,387.239924634458,2949.08985713009
"5","e2fe4b0fc492998f3ec0480f","Bogotá D.C",1250000000,7,2021,NA,NA,3,3,NA,0,"Venta","apartamento en el refugio bogota 22273 rah co x","en hermoso apartamento totalmente remodelado en el refugio chapinero bogota impresionantes vistas muy soleado e iluminado con acabados de primera calidad amplia cocina abierta con gabinetes de tecnologia alemana banos italianos cuarto de lavado cerrado tres habitaciones cada uno con baa o privado mas habitacion y bano de servicio lamparas de cristal de murano","0","0",c(-74.043268, 4.666951),365.194237965555,392.666068652185,365.194237965555,1458.36229874269,1492.70579431117,1831.8844651193,834.688311347382,372.947534200191,2577.65972472767
"6","448a92b57eaf63a17114c62b","Bogotá D.C",600000000,7,2021,NA,NA,2,2,NA,0,"Venta","espectacular apartamento la soledad","acogedor y calido apartamento con amplios espacios y vista exterior ubicacion privilegiada zona de alta izacion a escasos metros de la calle 45 park way avenida nqs cerca a universidad nacional centro comercial galerias carulla park way tranquilidad y seguridad en su entorno excelentes acabados tina en bano principal cocina tipo americano cita previa","0","0",c(-74.0609706, 4.6417567),165.638332454002,874.842124244041,165.638332454002,683.495072208956,175.18842377941,556.434421520674,473.216496911258,497.030394051673,1176.31323868687
"7","ab7452883b1d217669becc03","Bogotá D.C",890000000,8,2021,142,NA,3,3,3,0,"Venta","apartamento duplex en en la ciudad de bogota sector de chico","area 142mts2 consta de 3 habitaciones 2 banos 2 parqueaderos en linea cuarto de servicio con bano sala comedor cocina integral con barra tipo americana deposito y zona de lavanderia en edifico que cuenta con porteria recepcion salon comunal gimnasio turco sauna y jacuzzi vias de acceso facil restaurantes centros comerciales colegios universidades zona residencial zonas verdes y empresarial","0","1",c(-74.0559625626, 4.6853093138),528.081360265514,2943.01644597453,528.081360265514,221.496215508453,76.4562011908697,186.641903651602,1142.50618088978,416.61140855463,1358.20369485826
"8","8d55a4727b11e756011653de","Bogotá D.C",780000000,11,2020,167,NA,NA,4,2,1,"Venta","casa en bogota chapinero occidental","excelente casa de 167 mtrs2 construidos esta en un lote de 204 mtrs2 con 730 mtrs de frente por 28 mtrs de fondo la casa esta construida en 2 pisos la casa cuenta con 2 locales amplios en el primer piso y 2 apartamentos pequenos cada apto con 2 habitaciones 1 bano cocina sala comedor la casa esta muy bien ubicada tiene muy buenas vias de acceso y actualmente tiene un promedio de renta mensual de x","0","0",c(-74.0581187, 4.6506311),872.109375013489,358.112957457955,872.109375013489,364.353482944697,657.427165950481,721.408786441869,433.264016458915,159.596536949555,1640.31503555485
"9","80dfe146475acbcd85bba8eb","Bogotá D.C",700000000,7,2021,367,NA,1,1,NA,0,"Venta","apartaestudio duplex ed piscina terraza chico","apartaestudio amoblado con servicios incluidos duplex tipo loft en edificio con piscina y terraza comunal cancha de squash gimnacio zona humeda en chico norte 367m canon xxx cop administracion incluida disponible a partir del 1 de noviembre apartaestudio amoblado duplex tipo loft chico norte 3 bogota zonanorte colombia hermoso apartamento duplex tipo loft 67mts con administracion incluida area social en el primer piso bano social area de ropas sala comedor cocina area privada en el segundo piso bano closet habitacion puerta na semi balcon chimenea funcional lobby muy moderno tipo hotel con recepcion drive thru parqueadero de visitantes piscina climatizada jacuzzi turco sauna gimnasio sala de juntas salon de reuniones cancha de squash terraza comunal con asador y teppanyaki hermosa vista 360 banda en la terraza para caminar jardines naturales","1","1",c(-74.0537269, 4.6852987),403.131180604825,2691.9037506456,403.131180604825,55.2477353248708,145.959541911278,97.0003617636273,1153.06120274619,222.12759250112,1181.79174782994
"10","f834d1b37536ec6bcc649f0a","Bogotá D.C",334000000,7,2021,77,NA,3,3,2,0,"Venta","apartamento en en normandia","apartamento en en normandia apartamento de 77m2 con vista interior ubicado en un 3er piso acceso por escaleras parqueadero propio cubierto y deposito consta de 3 habitaciones 2 banos sala comedor cocina integral y zona de lavanderia tiene piso laminado en habitaciones y zona social y ceramico en banos y cocina el edificio cuenta con 2 terrazas salon comunal y vigilancia privada las 24 horas cerca de centro comercial gran estacion y centro empresarial el dorado cerca de almacenes de cadena como exito olimpica ara y d1 cerca a colegio republica de colombia y marco tulio fernandez cerca a estacion de transmilenio normandia vias de acceso por la av boyaca y av calle 53 administracion xxx de xxx si desea mayor informacion de este y otros inmuebles comunicate al x","1","1",c(-74.0629731, 4.6394206),503.225447835403,29.8287296228077,503.225447835403,341.833544982129,66.2678823446103,477.393450677622,717.024796786725,177.870862065579,836.417121369855
"11","ea7ba96107b36f79ccf03329","Bogotá D.C",1600000000,7,2021,NA,NA,3,3,1,0,"Venta","apartamento chico reservado","apartamento en en chico reservado duplex varios ambientes sala y comedor separados con chimenea cocina abierta tipo americano zona de lavanderia cuarto y bano de servicio autosustentable recicla el agua 3 alcobas cada una con bano estar de television 3 garajes 2 en linea y 1 independiente deposito zona exclusiva de bogota calle 94 carreras 9 y 7 contactenos para mas informacion","0","1",c(-74.0419548939, 4.6762252813),169.559274522993,17302.4077497185,169.559274522993,1644.92037975681,1479.29148089598,852.716578562525,1105.36780801137,1111.31676919786,1962.82964193713
"12","f12ef5b1c28bb41b134f7fdd","Bogotá D.C",670000000,7,2021,117,NA,3,3,3,0,"Venta","o renta apto bella suiza","117 m23 habitaciones 3 banos sala comedor cocina abierta con barra balcon 2 parqueaderos en linea 1 deposito de muy buen tamano estrato 53 anos de construido 2 piso exterior antiguedad 4 anos zonas comunes el edificio tiene roof garden con asador juegos para ninos chimenea a gas y vista a todo el norte de bogota 360 grados administracion xxx de xx 3 incluida la adm","1","1",c(-74.0574146, 4.6511173),947.869100464786,358.112957457955,947.869100464786,415.752229241619,621.989519324571,751.134743088895,465.685434495364,233.836654334502,1718.90204701069
"13","fb803dde9b6d93f11323dc3f","Bogotá D.C",710000000,7,2021,80,NA,2,2,2,0,"Venta","apartamento chico","80 mts balcon 3mts 2 cuartos 2 banos completos cocina americana chimenea claraboyas 2 parqueaderos en linea deposito xx xx 3200 admon","1","1",c(-74.0563072362, 4.679815354),452.962889933383,4896.81924414675,452.962889933383,438.878643305099,256.777728788723,402.056047904117,893.478385902025,787.015166449221,1837.55399721195
"14","c3dd244f7247a5aea8fb796f","Bogotá D.C",950000000,7,2021,NA,NA,3,3,NA,0,"Venta","apartamento en santa barbara bogota","te invitamos a conocer este excelente apartamento si deseas invertir o crear historia en tu nuevo hogar este espacio es para ti disfruta de sus amplios ambientes con chimenea en zona social y cuarto principal que cuenta con acceso a la terraza y bano privado su cocina espaciosa con isla le brinda comodidad y sus habitaciones calidas y silenciosas son perfectas para descansar en edificio de pocos residentes a tan solo minutos de supermercados y parques inmejorables vias de acceso carrera 9 y calle 116 aparta ya tu cita","1","0",c(-74.0486934, 4.6839706),350.635787896475,232.423226052926,350.635787896475,552.981312380173,363.445276412183,438.372755555033,1478.57667228865,540.497033809374,1056.08170107918
"15","caff436bee98fb9d437518e8","Bogotá D.C",850000000,6,2021,192,NA,3,3,NA,0,"Venta","apartamento en chico navarra rah co 2190","rentahouse vende apartamento en bogota d c aprovecha este inmueble de 192 m2 en excelente estado soy carolina solano contactame y con mucho gusto te amplio la informacion","0","0",c(-74.056506, 4.685555),554.507672846343,2943.01644597453,554.507672846343,219.060059179058,67.2969242417369,143.280950753155,1121.20925159277,452.757135525887,1387.52101274474
"16","3760dd4f142d57a98d34be57","Bogotá D.C",900000000,6,2021,110,NA,3,3,NA,0,"Venta","apartamento en chico navarra rah co 2192","rentahouse vende apartamento en bogota d c aprovecha este inmueble de 110 m2 en excelente estado soy carolina solano contactame y con mucho gusto te amplio la informacion","0","0",c(-74.056248, 4.685811),590.753678979244,2943.01644597453,590.753678979244,255.592341764555,101.324699399067,122.851964605358,1089.66377860703,414.119542941667,1347.46842152561
"17","9346dd60240cb46ebe72813b","Bogotá D.C",1450000000,6,2021,235,NA,3,3,NA,0,"Venta","apartamento en chico navarra rah co 2196","rentahouse vende apartamento en bogota d c aprovecha este inmueble de 16235 m2 en excelente estado soy carolina solano contactame y con mucho gusto te amplio la informacion","0","0",c(-74.04987, 4.681485),320.38673626594,507.322945702432,320.38673626594,606.19456892144,473.960080514553,600.586845679347,1239.76907298218,674.772893217723,1355.72698947206
"18","0004d06d2778d52349a2f6e7","Bogotá D.C",1250000000,6,2021,592,NA,3,3,NA,0,"Venta","apartamento en el refugio bogota rah co x","rentahouse vende apartamento en bogota d c aprovecha este inmueble de 1592 m2 en excelente estado soy carolina solano contactame y con mucho gusto te amplio la informacion","0","0",c(-74.043268, 4.666951),365.194237965555,392.666068652185,365.194237965555,1458.36229874269,1492.70579431117,1831.8844651193,834.688311347382,372.947534200191,2577.65972472767
"19","d0aeaf14b38efc69738e87e0","Bogotá D.C",1250000000,6,2021,NA,NA,3,3,NA,0,"Venta","apartamento en el refugio bogota 22273 rah co x","en hermoso apartamento totalmente remodelado en el refugio chapinero bogota impresionantes vistas muy soleado e iluminado con acabados de primera calidad amplia cocina abierta con gabinetes de tecnologia alemana banos italianos cuarto de lavado cerrado tres habitaciones cada uno con baa o privado mas habitacion y bano de servicio lamparas de cristal de murano","0","0",c(-74.043268, 4.666951),365.194237965555,392.666068652185,365.194237965555,1458.36229874269,1492.70579431117,1831.8844651193,834.688311347382,372.947534200191,2577.65972472767
"20","4879cf61eff2a87fa5be5ab8","Bogotá D.C",320000000,6,2021,52,NA,NA,3,2,0,"Venta","apartamento en bogota teusaquillo","gran oportunidad para inversionistas apartamento de 52 mts rentando consta de 3 alcobas 2 banos sala comedor cocina cerrada semi integral a gas pisos en ceramica exterior garaje cubierto sin ascensor parqueadero visitantes estrato 4 cerca a universidades","0","1",c(-74.0626028, 4.6317232),232.399014933084,1330.85772175193,232.399014933084,318.779479694094,431.432874341634,586.447376132309,628.551166986861,194.544625648926,528.384053154407
"21","0df48f5d183ad1fce6b97a42","Bogotá D.C",377801270,5,2021,54,54,1,1,2,0,"Venta","apartamento en en bogota san luis teusaquillo cod vpre63129","aparta estudio y o 2 alcobas san luis bogota solo quedan 3 apartamentos ubicados en una zona central tranquila residencial apartamentos con luz natural 2 bao s closet o walking closet el aparta estudio con balcn cocina abierta estufa a gas espacio para nevecon mesn ideal para usar a un lado como barra americana comedor al interior del muebles apto para guardar utensilios zona lavandera independiente acabados modernos 1 garaje las principales vas de comunicacin del barrio son la avenida caracas las carreras 17 y 24 y las calles 57 y 63 en cuanto al comercio el sector no cuenta con centros comerciales sin embargo en los inmuebles localizados sobre las principales vas de acceso se ha generado un comercio informal pero la ubicacin del barrio permite a sus habitantes llegar fcilmente a los centros comerciales de chapinero lourdes siete de agosto y galeras","0","1",c(-74.055, 4.643),591.822469026254,22511.158927863,591.822469026254,1205.94113801211,843.314706609544,1201.02434324851,482.432543290258,406.257617855133,1735.33249861082
"22","b88d1e77d5a2f0f2a6f08e91","Bogotá D.C",950000000,7,2021,NA,NA,2,2,NA,0,"Venta","apartamento la cabrera","hermoso apartamento remodelado ubicado en zona residencial cerca servicio de transporte publico cada piso del edificio cuenta con shut de basura","0","0",c(-74.0478546, 4.6641858),174.575148224191,781.67030544907,174.575148224191,1080.92219907714,1076.08774532513,1443.25104810174,723.686182062054,217.578727273415,3155.89860552769
"23","7c570ca6f1b4f1cc26865f35","Bogotá D.C",380000000,7,2021,NA,NA,3,3,2,0,"Venta","y o apto en metropolis 3 hab mi a","y o amplio apartamento en metropolis tercer piso iluminado consta de tres habitaciones dos banos sala comedor cocina cbs y parqueadero","0","1",c(-74.0534393, 4.6560408),703.721829767712,507.402605186856,703.721829767712,941.104694334043,622.192886958156,988.422410649866,290.302454076706,459.189481843378,2238.62015455631
"24","ea385b743106fd7664a260bb","Bogotá D.C",1250000000,6,2021,592,NA,3,3,NA,0,"Venta","apartamento en el refugio bogota rah co 22273","rentahouse cajica vende apartamento en el refugio bogota d c con un area de 1592 m2 para mayor informacion contactanos y te brindaremos todo lo que nesecitas saber del predio c o","0","0",c(-74.043268, 4.666951),365.194237965555,392.666068652185,365.194237965555,1458.36229874269,1492.70579431117,1831.8844651193,834.688311347382,372.947534200191,2577.65972472767
"25","51be47ff62cb524eec61b56b","Bogotá D.C",520000000,8,2021,NA,NA,2,2,2,0,"Venta","apartamento en chico","te ofrecemos este lindo apartamento ubicado en una de las zonas mas cotizadas de bogota el edificio cuenta con piscina zonas humedas salones de reuniones terraza tepayaki terraza bbq gimnasio salon social el apartamento es bastante iluminado y acogedor agenda ya tu cita","1","0",c(-74.0554998, 4.6846867),442.483624380759,2943.01644597453,442.483624380759,210.865970551151,120.234237763914,234.089888554755,1209.25517563508,409.641843808497,1366.9161938685
"26","857f33cad8cc96e2d05b933e","Bogotá D.C",850000000,7,2021,NA,NA,3,3,3,0,"Venta","de apartamento en rosales ap 046","o apartamento ubicado en 4to piso cuenta con 3 habitaciones 3 banos totalmente remodelado hace 5 anos cocina abierta lavavajillas torre de horno 2 parqueaderos independientes 1 deposito edf zona infantil parque gym salon social parqueaderos de visitantes ap 046","0","1",c(-74.0487393, 4.6614037),89.3126367657229,2048.3429984337,89.3126367657229,1163.24657632472,1161.82665392104,1400.87539393721,586.92102163918,415.275298707836,2931.48507568732
"27","3a3d330892a7157bedc83fc0","Bogotá D.C",1560000000,8,2021,200,NA,3,3,3,0,"Venta","apartamento 200m2 rosales 23 hab 3parq estudio","apartamento de 200m2 con diseno en areas interiores espacioso pisos en madera granadillo chimenea a gas instalacion de sonido incluyendo balcon lobby de recibimiento estudio dos salas comedor independiente amplia habitacion principal con estudio walking closet segunda habitacion con bano hermosa cocina cerrada en la mejor localizacion del sector con recepcion tipo hotel gimnasio y espacio de recreacion para ninos jardines le programamos su cita para conocerlo se enamorara","1","0",c(-74.0509746673, 4.6563523487),535.333195146229,507.402605186856,535.333195146229,1203.8242224397,893.590336703094,1249.06503740082,210.103725498779,643.17901150742,2511.50655862559
"28","912a9a03a0c4c531bbfe0f91","Bogotá D.C",1350000000,7,2019,206,206,3,3,3,0,"Venta","apartamento en en bogota chico norte iii","apartamento en ubicado en sector residencial con buena iluminacin natural amplios espacios y gran terraza vas de acceso como la cll 94 y dg 92","1","0",c(-74.052, 4.681),121.886309595015,2241.57604926176,121.886309595015,540.583107428605,485.561951024445,592.851212707522,1206.50606155317,661.967870680481,1485.36335291739
"29","06e6a70c5352d832ed993a52","Bogotá D.C",455000000,7,2019,62,62,2,2,2,0,"Venta","apartamento en en bogota chico norte iii","magnifico apartamento para en chico norte de 62 m2 con linda vista en octavo piso y muy iluminado dos alcobas dos baos sala comedor con balcn cocina abierta y zona de lavandera el edificio cuenta con piscina terraza comunal con bbq saln comunal billar sala de reuniones y parqueaderos de visitantes","1","1",c(-74.056, 4.686),589.524975343052,2943.01644597453,589.524975343052,285.918348421244,131.64637189583,118.622618088718,1066.23047056016,380.100184521699,1312.87110935707
"30","c405060ec323bd59cc476082","Bogotá D.C",850000000,6,2019,104,104,3,3,3,0,"Venta","apartamento en en bogota chapinero alto","lindo apartamento para abajo de la circunvalar de 104 m2 con terraza en chapinero alto sala comedor cocina abierta con isla zona de lavandera independiente y closet de linos tres alcobas principal con vestier y acceso al balcn tres baos vista exterior y muy iluminado edificio con gimnasio saln comunal parqueadero de visitante zona infantil squash zonas verdes dos ascensores y vigilancia permanente estrato 4","1","1",c(-74.054, 4.645),733.399141415603,3864.18140389962,733.399141415603,1115.16212498572,1004.6717740277,1261.82648049309,373.336719250711,161.769947181406,1964.30319737418
"31","0bb87e16cd43c8ec3d69b979","Bogotá D.C",568268369,6,2019,78,78,2,2,2,0,"Venta","apartamento en en bogota chapinero alto","apartamento para estrenar vista a cerros orientales el apartamento lo conforman un saln comedor contigua a una cocina abierta zona de lavandera el hall de habitaciones separa el area social de las alcobas ac tenemos el bao social y de la segunda alcoba la alcoba principal con un amplio closet de pared a pared y bao privado y la segunda alcoba con su closet tiene un parqueadero cubierto y un deposito el edificio cuenta con zona de lavandera comunal gimnasio zona social caldera planta elctrica y vigilancia 247","0","1",c(-74.051, 4.652),1005.03221981188,10642.9745048027,1005.03221981188,1109.12101857761,1020.10898413145,1373.92689166288,506.330876176075,350.663461468005,2433.43751371807
"32","c6f9552e2e7a61144e09a981","Bogotá D.C",563066904,6,2019,78,78,2,2,2,0,"Venta","apartamento en en bogota chapinero alto","apartamento para estrenar vista a cerros orientales el apartamento lo conforman un saln comedor contigua a una cocina abierta zona de lavandera el hall de habitaciones separa el area social de las alcobas ac tenemos el bao social y de la segunda alcoba la alcoba principal con un amplio closet de pared a pared y bao privado y la segunda alcoba con su closet tiene un parqueadero cubierto y un deposito el edificio cuenta con zona de lavandera comunal gimnasio zona social caldera planta elctrica y vigilancia 247","0","1",c(-74.051, 4.652),1005.03221981188,10642.9745048027,1005.03221981188,1109.12101857761,1020.10898413145,1373.92689166288,506.330876176075,350.663461468005,2433.43751371807
"33","a2bd2e373a12d644beab9451","Bogotá D.C",370000000,5,2019,57,57,1,1,2,0,"Venta","apartaestudio en en bogota chapinero alto","gran oportunidad aparta estudio en con vista panoramica a la montaa cerca al carulla de la calle 63 colegio nueva granada y vas principales como av circunvalar cra 7 y calle 72 sector residencial y tranquilo consta de hall de acceso sala comedor 1 habitacin con closet bao privado y cortinas blackout bao auxiliar pisos en madera laminada cocina integral abierta tipo americano con muebles en madera y mesn en mrmol estufa mixta horno elctrico zona de lavandera con tendedero calentador de paso a gas 2 garajes cubiertos con servidumbre 1 deposito patio cubierto 2 ascensores zonas sociales saln comunal parqueadero para visitantes cancha de squash planta elctrica gimnasio turco cmaras internas circuito cerrado de tv puerta blindada alarma citofono vigilancia y recepcin 24 horas neria termoacustica en bao principal y patio","1","1",c(-74.053, 4.647),921.398546803973,3864.18140389962,921.398546803973,1058.95644206684,1196.25720542841,1325.52996687238,411.70418828823,103.803728312049,2197.51567339596
"34","77ed063064d419baccd4f3a7","Bogotá D.C",400000000,5,2019,61,61,1,1,1,0,"Venta","apartaestudio en en bogota chapinero alto","apartaestudio de 6098 mts cuenta con una habitacin con closet bao social cocina integral abierta elctrica calentador elctrico zona de lavandera independiente sala comedor balcn pisos en madera laminada un garaje cubierto y un depsito el edificio cuenta con planta elctrica tanque de agua ascensor recepcin parqueadero de visitantes y seguridad privada x","0","1",c(-74.06, 4.647),434.543761342546,1273.32517255094,434.543761342546,588.729328567078,626.707879109052,561.161116870694,278.802506774469,309.62332011442,1490.21303536356
"35","67ed2c6fa7dc14163d45134e","Bogotá D.C",850000000,5,2019,89,89,2,2,3,0,"Venta","apartamento en en bogota virrey","hermoso para estrenar moderno 2 alcobas 3 baos interior muy iluminado chimenea a gas pisos laminados amplios espacios deposito y garaje doble el edificio cuenta con caldera terraza social al costado del parque del virrey ubicado en buen sector fciles vas de acceso para mayor informacin comunicarse con claudia sarmiento","1","1",c(-74.053, 4.673),256.37720655836,28558.0030150157,256.37720655836,510.992460584548,649.013300209295,718.514097596164,446.097528598155,131.584960301433,2358.84280932985
"36","79b8fa76bf816964d3223d9b","Bogotá D.C",1600000000,5,2019,155,155,2,2,3,0,"Venta","apartamento en en bogota los rosales","apartamento con vista exterior a los cerros orientales a la ciudad y al norte ascensor directo al apartamento y de servicio habitacin principal con balcn walk in closet y bao una alcoba adicional con bao y vista a la ciudad sala comedor bao social pisos en madera chimenea balcn calefaccin home theater cocina integral a gas zona de lavandera independiente bao de servicio 3 parqueaderos y depsito el edificio posee terraza con rea de bbq y saln para eventos","1","1",c(-74.049, 4.656),545.08560546386,1342.57933951723,545.08560546386,1396.07493064708,1113.57861256986,1471.37786291397,18.2914695767159,846.87364768457,2715.23296172934
"37","80cbca27de2b76138dce5981","Bogotá D.C",680000000,5,2019,89,89,2,2,3,0,"Venta","apartamento en en bogota chico norte iii","traemos para ti este acogedor apartamento en octavo piso exterior ubicado en edificio de 6 aos de construido sector residencial con numerosos sitios de inters parques cercanos supermercados y bancos vas de acceso principales como la auto norte la av 19 la calle 92 contacto bertha c ruiz x","0","0",c(-74.056, 4.682),361.618112478211,4896.81924414675,361.618112478211,223.796295191983,161.015066831782,235.710290184108,1080.43529484211,667.081777367669,1624.27377467992
